Nombre,Reduviidae,Coreidae,Pentatomide,Alydidae,Scutelleridae,Tingidae,Miridae,Lygaeidae,Rhopalidae,Nabidae,Anthocoridae,Cimicidae,Belostomatidae,Nepidae,Notonectidae,Corixidae,Gerridae,Veliidae,Gelastocoridae,Saldidae
Forma,Alargados y robustos,Grandes y robustos,"Ovalado, cuerpo ancho",Ligeramente alargados,"Ovalados, dorsoventrales",Pequeño(1-5mm) alargados,"Pequeños, blandos","Medianos, cuerpos alargados","Medianos, parecidos a lygaeidae","Alargados, esbeltos",Pequeños(2-5mm) alargados,Aplanados,Cuerpo plano hasta 8cm,Cuerpo alargado o de hoja,"En forma de huso, convexo",Aplanados dorsalmente,"Cuerpo alargado, patas largas","Similares a gerridae, mas pequeños","Cuerpo abultado, como sapo",Pequeños oscuros
Antenas,Largas y finas,Largas y gruesas,5 segmentos,"Largas, similares a coreidae","Cortas, no sobresalen del cuerpo",Cortas,"Largas, 4 segmentos",4 segmentos,4 segmentos ,Largas finas,Cortas,"Cortas , ocultas",Cortas,Cortas,Muy cortas,Cortas,Muy largas,Proporcionalmente largas,Muy cortas,Cortas
Alas,Hemielitros,Hemielitros grandes,Escutelo grande,Membranosas,Escutelo enorme,Con aspecto de encaje,Hemilitros con cuneus visible,Alas simples sin cuneo,Membrana alar con muchas venas,Alas completas delgadas,Hemielitros membranosos,"Alas reducidas, no funcionales",Alas bien desarrolladas,Alas plegadas sobre abdomen,Alas largas,Alas cruzadas sobre el dorso,Alas variables,Alas cortas o ausentes,Alas membranosas,Alas parcialmente transparentes
Habitat,"Vegetacion, troncos, casas",Vegetacion,"En hierbas, troncos, cultivos",En hierbas y gramineas,Vegetacion arbustiva,En el enves de hojas,Plantas herbaceas,Suelo cerca de semillas,Vegetacion arbustos,En vegetacion o bajo corteza,"Flores, corteza, cultivos","Nidos de aves, casas",Aguas dulces y estancadas,Aguas lentas,Aguas dulces,Aguas lentas,Superficies de agua,Aguas lentas,Orillas de rios o charcas,Margenes de cuerpos de agua
Notas clave,"Cabeza alargada, rostro curvado",Cabeza pequeña,"Cabeza ancha, escutelo triangular",Se parecen a formicidos,Colores metalicos,Alas y pronoto reticulados,Presentan un cuneo,Membra alar con 4-5 venas,Glandulas odoriferas,Patas delanteras raptoras,Cuerpos oscuros bandas blancas,Ectorpasito hematofagos,Respiran por sifon,Sifon respiratorio largo,"Nadan boca arriba, predadores",nadan boca abajo,Patas medias muy largas,Movimiento por tension superficial,"Camuflaje criptico, ojos saltones",Corren rapidamente a la orilla
fotoEnlace,../FOTOS/Reduviidae01.jpeg,../FOTOS/Coreidae.jpeg,https://static.inaturalist.org/photos/7794663/large.jpg,https://inaturalist-open-data.s3.amazonaws.com/photos/19952487/original.jpeg,https://static.inaturalist.org/photos/13419925/large.jpeg,https://www.britishbugs.org.uk/heteroptera/Tingidae/Tingidae_images/kalama_tricornis_4.jpg,https://genent.cals.ncsu.edu/wp-content/uploads/2015/07/mirid04.jpg,,https://www.britishbugs.org.uk/heteroptera/Rhopalidae/Rhopalidae_images/s_punctatonervosus_1.jpg,https://www.britishbugs.org.uk/heteroptera/Nabidae/Nabidae_images/nabis_ferus_1.jpg,https://warehouse1.indicia.org.uk/upload/med-16/80/79/o_1gtbid322mo7e1vla11lmjtuu1i.jpg,https://pictureinsect.com/wiki-image/1080/338146619220656128.jpeg,https://upload.wikimedia.org/wikipedia/commons/c/c7/Belostomatidae_HuntingtonVT.jpg,https://warehouse1.indicia.org.uk/upload/med-14/95/22/o_1bgh13hokktj1gtuofsmql1df5b.jpg,https://upload.wikimedia.org/wikipedia/commons/thumb/c/cf/Notonecta_maculata_MHNT_dos.jpg/250px-Notonecta_maculata_MHNT_dos.jpg,https://www.aquaportail.com/pictures2001/corixidae-corixa-punctata.jpg,https://image.laji.fi/MM.272242/Gerris_sphagnetorum_02.jpg,https://www.aquaportail.com/aquabdd/photos/velia-caprai.webp,https://inaturalist-open-data.s3.amazonaws.com/photos/6203055/original.jpeg,https://warehouse1.indicia.org.uk/upload/med-o_1i5t8ugq0erm1l5o1oq61nu8fpjs.jpg
